{"canonicalChecksum":"c494abc994b1f4e2bdd1f53feb276c73ea550d5aa6123efd4a64c11bd3cc9db2","caveNetworkCanonicalChecksum":"3f0a132fc643a41d66cc100fcb44d9ab8e89b5c814eb7a3560ce870469d21750","caveNetworkFeatureId":"cave.fixture-network","caveRelationId":"sinkhole-entrance-of-cave","collapseMaskFieldId":"foundation.sinkhole.collapse-mask","collapseRadiusBlocks":4,"estimatedWorkUnits":1920,"featureId":"karst-sinkhole","geometryChecksum":"506a4b463bf378a72104260bdacc2768903805eda2951e7ad0576b0a01f14b9e","lossVolumeBlocks":120,"materialHandoffId":"karst-limestone-handoff","openingXMillionths":5040000,"openingYMillionths":20000000,"openingZMillionths":0,"ownershipFieldId":"foundation.sinkhole.ownership","planVersion":1,"reachabilityFieldId":"foundation.sinkhole.reachability","roofClearanceBlocks":3,"roofClearanceFieldId":"foundation.sinkhole.roof-clearance","supportRadiusXZ":7,"surfaceHostFeatureId":"karst-plain","surfaceHostGeometryChecksum":"7558388a2553d2d47f49b3a961aad8683603fcf410b9d8e5497c7f669224c829","surfaceHostRelationId":"sinkhole-supported-by-plain","targetEntranceNodeId":"n.entrance"}